{
  "id": "eval/argument-order-first-fault",
  "spec": [
    "spec/language/surface.md#4-выражения",
    "spec/runtime/machine.md#5-примитивы-и-fault"
  ],
  "origin": "independent",
  "levels": [
    "L2"
  ],
  "files": [
    "main.bag"
  ],
  "run": {
    "entry": "main.main"
  },
  "expect": {
    "phase": "run",
    "effects": [],
    "outcome": "FAULT",
    "code": "DIVISION_BY_ZERO"
  }
}
