{
  "id": "migrate/crash-swap-01",
  "spec": [
    "spec/runtime/host.md#7-миграция",
    "spec/runtime/host.md#8-сбои-и-восстановление"
  ],
  "origin": "independent",
  "levels": [
    "L2"
  ],
  "files": [
    "app.bag",
    "v2/app.bag"
  ],
  "run": {
    "steps": [
      {
        "op": "seed",
        "table": "app.S.counts",
        "rows": [
          [
            {
              "type": "String",
              "value": "b"
            },
            {
              "type": "Int64",
              "value": "7"
            }
          ],
          [
            {
              "type": "String",
              "value": "a"
            },
            {
              "type": "Int64",
              "value": "5"
            }
          ]
        ]
      },
      {
        "op": "migrate",
        "crash_at": "before_swap_commit",
        "program": "v2"
      },
      {
        "op": "migrate",
        "program": "v2"
      },
      {
        "op": "migrate",
        "crash_at": "after_swap",
        "program": "v2"
      }
    ],
    "state_program": "v2"
  },
  "expect": {
    "phase": "migrate",
    "outcome": "COMPLETED",
    "value": [
      {
        "outcome": "COMMITTED",
        "rows": 2,
        "state_version": 1
      },
      {
        "outcome": "CRASHED",
        "at": "before_swap_commit"
      },
      {
        "outcome": "APPLIED",
        "epoch": 1,
        "state_version": 2,
        "rows": 2,
        "tables": [
          {
            "table": "app.S.counts",
            "id": "aa0003",
            "action": "migrate",
            "migration": "app.to_tally",
            "from": "Int64",
            "to": "app.Tally"
          },
          {
            "table": "app.S.seen",
            "id": "aa0004",
            "action": "keep"
          }
        ],
        "events": [
          {
            "event": "app.Bumped",
            "id": "aa0005",
            "action": "keep"
          }
        ]
      },
      {
        "epoch": 1,
        "state_version": 2,
        "outcome": "UP_TO_DATE",
        "tables": [],
        "events": []
      }
    ],
    "state": {
      "state_version": 2,
      "epoch": 1,
      "tables": {
        "app.S.counts": [
          [
            {
              "type": "String",
              "value": "a"
            },
            {
              "type": "app.Tally",
              "fields": {
                "total": {
                  "type": "Int64",
                  "value": "5"
                },
                "bumps": {
                  "type": "Int64",
                  "value": "1"
                }
              }
            }
          ],
          [
            {
              "type": "String",
              "value": "b"
            },
            {
              "type": "app.Tally",
              "fields": {
                "total": {
                  "type": "Int64",
                  "value": "7"
                },
                "bumps": {
                  "type": "Int64",
                  "value": "1"
                }
              }
            }
          ]
        ],
        "app.S.seen": []
      },
      "outbox": [],
      "inbox": [],
      "pending": []
    }
  }
}
