{
  "id": "store/commit-retry-01",
  "spec": [
    "spec/runtime/host.md#3-команда",
    "spec/kernel/outcomes.md#3-исход-точки-входа"
  ],
  "origin": "independent",
  "levels": [
    "L2"
  ],
  "files": [
    "app.bag"
  ],
  "run": {
    "steps": [
      {
        "op": "command",
        "entry": "app.bump",
        "args": [
          {
            "type": "String",
            "value": "a"
          },
          {
            "type": "Int64",
            "value": "5"
          }
        ],
        "namespace": "app",
        "key": "key-000000000001"
      },
      {
        "op": "command",
        "entry": "app.bump",
        "args": [
          {
            "type": "String",
            "value": "a"
          },
          {
            "type": "Int64",
            "value": "5"
          }
        ],
        "namespace": "app",
        "key": "key-000000000001"
      },
      {
        "op": "query",
        "entry": "app.get",
        "args": [
          {
            "type": "String",
            "value": "a"
          }
        ]
      },
      {
        "op": "status",
        "namespace": "app",
        "key": "key-000000000001"
      }
    ]
  },
  "expect": {
    "phase": "store",
    "outcome": "COMPLETED",
    "value": [
      {
        "value": {
          "type": "Result<Int64,app.BumpError>",
          "tag": "Ok",
          "payload": {
            "type": "Int64",
            "value": "5"
          }
        },
        "outcome": "COMMITTED",
        "final": true,
        "replayed": false,
        "state_version": 1
      },
      {
        "value": {
          "type": "Result<Int64,app.BumpError>",
          "tag": "Ok",
          "payload": {
            "type": "Int64",
            "value": "5"
          }
        },
        "outcome": "COMMITTED",
        "final": true,
        "replayed": true,
        "state_version": 1
      },
      {
        "outcome": "RETURNED",
        "value": {
          "type": "Option<Int64>",
          "tag": "Some",
          "payload": {
            "type": "Int64",
            "value": "5"
          }
        }
      },
      {
        "value": {
          "type": "Result<Int64,app.BumpError>",
          "tag": "Ok",
          "payload": {
            "type": "Int64",
            "value": "5"
          }
        },
        "outcome": "RESULT",
        "receipt_outcome": "COMMITTED",
        "state_version": 1
      }
    ],
    "state": {
      "state_version": 1,
      "epoch": 0,
      "tables": {
        "app.S.counts": [
          [
            {
              "type": "String",
              "value": "a"
            },
            {
              "type": "Int64",
              "value": "5"
            }
          ]
        ],
        "app.S.seen": []
      },
      "outbox": [
        {
          "seq": 1,
          "event": "app.Bumped",
          "payload": {
            "type": "app.Bumped",
            "fields": {
              "name": {
                "type": "String",
                "value": "a"
              },
              "total": {
                "type": "Int64",
                "value": "5"
              }
            }
          }
        }
      ],
      "inbox": [],
      "pending": [
        {
          "handler": "app.remember",
          "seq": 1
        }
      ]
    }
  },
  "note": "повтор с тем же ключом возвращает квитанцию и ничего не меняет (HST-05, HST-06)"
}
