{
  "id": "parse/missing-comma-in-match",
  "spec": [
    "spec/language/surface.md#6-правила-разбора-которые-грамматика-не-выражает"
  ],
  "origin": "independent",
  "levels": [
    "L2"
  ],
  "files": [
    "main.bag"
  ],
  "expect": {
    "phase": "parse",
    "outcome": "PRELAUNCH",
    "diagnostics": [
      {
        "code": "MISSING_COMMA_IN_MATCH",
        "file": "main.bag",
        "span": [
          65,
          65
        ]
      }
    ]
  }
}
