{
  "id": "impact/std-alias-01",
  "spec": [
    "spec/links/08-bagaev-extraction.md#3-рёбра",
    "spec/links/08-bagaev-extraction.md#5-влияние"
  ],
  "origin": "independent",
  "levels": [
    "L2"
  ],
  "files": [
    "app.bag",
    "cand/app.bag"
  ],
  "run": {
    "links": {
      "op": "impact",
      "candidate": "cand"
    }
  },
  "expect": {
    "phase": "impact",
    "outcome": "IMPACT",
    "value": {
      "status": "COMPLETE",
      "readiness": "NO_OPEN_OBLIGATIONS",
      "seeds": [
        [
          "app",
          "changed"
        ],
        [
          "app.combine",
          "edge-removed"
        ]
      ],
      "in_scope": [
        [
          "app",
          0
        ],
        [
          "app.combine",
          0
        ],
        [
          "app.twice",
          1
        ]
      ],
      "unknown": [],
      "unknown_incomplete": 0,
      "frontier": [],
      "obligations": [],
      "closed": [],
      "tests_to_run": [],
      "gaps": [],
      "watch": {}
    }
  },
  "note": "подмена импорта std меняет цель ребра calls к std:<имя> — источник становится семенем (ревью m5 H1)"
}
