{
  "id": "l1/core-c18",
  "spec": [
    "spec/runtime/machine.md#7-соответствие-core-01",
    "spec/runtime/machine.md#4-закрытый-каталог-правил"
  ],
  "origin": "model:models/r07-core/fixtures/core-machine.json#C18",
  "levels": [
    "L1",
    "L2"
  ],
  "files": [
    "main.bag"
  ],
  "run": {
    "entry": "main.main"
  },
  "expect": {
    "phase": "run",
    "effects": [],
    "outcome": "RETURNED",
    "value": {
      "type": "Unit"
    },
    "steps": 1,
    "trace_l1": [
      "CONST"
    ]
  }
}
