{
  "id": "eval/record-update-order",
  "spec": [
    "spec/language/surface.md#4-выражения",
    "spec/ir/bir.md#2-формы"
  ],
  "origin": "independent",
  "levels": [
    "L2"
  ],
  "files": [
    "main.bag"
  ],
  "run": {
    "entry": "main.main"
  },
  "expect": {
    "phase": "run",
    "effects": [],
    "outcome": "RETURNED",
    "value": {
      "type": "Int64",
      "value": "15"
    }
  }
}
