{
  "id": "impact/why-excluded-recheck-applicable-01",
  "spec": [
    "spec/links/08-bagaev-extraction.md#5-влияние"
  ],
  "origin": "independent",
  "levels": [
    "L2"
  ],
  "files": [
    "alt/app.bag",
    "app.bag",
    "cand/app.bag"
  ],
  "run": {
    "links": {
      "op": "why",
      "candidate": "cand",
      "entity": "app.apply",
      "recheck": "alt"
    }
  },
  "expect": {
    "phase": "impact",
    "outcome": "WHY",
    "value": {
      "outcome": "EXCLUDED",
      "basis": [
        "D83b-no-dependency-path"
      ],
      "recheck": [
        "applicable"
      ]
    }
  }
}
