{
  "id": "stdlib/bytes-concat",
  "spec": [
    "spec/stdlib/acceptance.md",
    "spec/runtime/machine.md#5-примитивы-и-fault"
  ],
  "origin": "independent",
  "levels": [
    "L2"
  ],
  "files": [
    "main.bag"
  ],
  "run": {
    "entry": "main.main"
  },
  "expect": {
    "phase": "run",
    "effects": [],
    "outcome": "RETURNED",
    "value": {
      "type": "Bytes",
      "hex": "00ff"
    }
  },
  "note": "SA-042"
}
