{
  "id": "fmt/blocks",
  "spec": [
    "spec/language/format.md#блоки-и-выражения"
  ],
  "origin": "independent",
  "levels": [
    "L2"
  ],
  "files": [
    "main.bag"
  ],
  "expect": {
    "phase": "fmt",
    "outcome": "FORMATTED",
    "value": {
      "main.bag": "module m\n\nfn f() -> Int64 {\n  let x: Int64 = 1;\n\n  {\n    x\n  };\n  if x == 1 {\n    2\n  } else {\n    3\n  }\n  {}\n  x\n}\n"
    }
  }
}
